{
  "v": 1,
  "vocab": "travel",
  "title": "Travel preferences interview",
  "sections": [
    {
      "id": "pace",
      "title": "Pace & rhythm",
      "questions": [
        {"qid":"pace-01","text":"How full should a typical sightseeing day be?","kind":"scale","dimension":"pace",
          "options": [
            {"label":"Relaxed","value":"relaxed","polarity":"+"},
            {"label":"Normal","value":"normal","polarity":"+"},
            {"label":"Packed","value":"packed","polarity":"+"}
          ],
          "skip_ok": true },
        {"qid":"pace-02","text":"Do you like to start early or late?","kind":"pick","dimension":"day_rhythm",
          "options": [
            {"label":"Early riser","value":"early","polarity":"+"},
            {"label":"Flexible","value":"flexible","polarity":"+"},
            {"label":"Late starter","value":"late","polarity":"+"}
          ],
          "skip_ok": true },
        {"qid":"pace-03","text":"How much unplanned free time do you want in a day?","kind":"scale","dimension":"free_time",
          "options": [
            {"label":"A little","value":"little","polarity":"+"},
            {"label":"Some","value":"some","polarity":"+"},
            {"label":"Lots","value":"lots","polarity":"+"}
          ],
          "skip_ok": true }
      ]
    },
    {
      "id": "food",
      "title": "Food",
      "questions": [
        {"qid":"food-01","text":"Which foods do you look forward to? Pick any.","kind":"multi","dimension":"food",
          "options": [
            {"label":"Local specialties","value":"local specialties","polarity":"+"},
            {"label":"Seafood","value":"seafood","polarity":"+"},
            {"label":"Noodles","value":"noodles","polarity":"+"},
            {"label":"Bakeries","value":"bakeries","polarity":"+"},
            {"label":"Grilled meat","value":"grilled meat","polarity":"+"},
            {"label":"Desserts","value":"desserts","polarity":"+"}
          ],
          "skip_ok": true },
        {"qid":"food-02","text":"Any foods you would rather not eat? (Not allergies: the next question covers those.)","kind":"multi","dimension":"food",
          "options": [
            {"label":"Shellfish","value":"shellfish","polarity":"-"},
            {"label":"Offal","value":"offal","polarity":"-"},
            {"label":"Raw fish","value":"raw fish","polarity":"-"},
            {"label":"Very sweet food","value":"very sweet food","polarity":"-"}
          ],
          "skip_ok": true },
        {"qid":"food-03","text":"Is there anything you cannot eat?","kind":"multi","dimension":"dietary",
          "options": [
            {"label":"Gluten","value":"gluten","polarity":"-"},
            {"label":"Dairy","value":"dairy","polarity":"-"},
            {"label":"Nuts","value":"nuts","polarity":"-"},
            {"label":"Shellfish","value":"shellfish","polarity":"-"},
            {"label":"Pork","value":"pork","polarity":"-"},
            {"label":"Beef","value":"beef","polarity":"-"},
            {"label":"Any meat","value":"meat","polarity":"-"},
            {"label":"Eggs","value":"eggs","polarity":"-"},
            {"label":"Alcohol","value":"alcohol","polarity":"-"}
          ],
          "skip_ok": true },
        {"qid":"food-04","text":"How spicy do you like your food?","kind":"scale","dimension":"spice",
          "options": [
            {"label":"Mild","value":"mild","polarity":"+"},
            {"label":"Medium","value":"medium","polarity":"+"},
            {"label":"Hot","value":"hot","polarity":"+"}
          ],
          "skip_ok": true },
        {"qid":"food-05","text":"How do you like to eat while travelling? Pick any.","kind":"multi","dimension":"meal_style",
          "options": [
            {"label":"Street food","value":"street food","polarity":"+"},
            {"label":"Markets","value":"markets","polarity":"+"},
            {"label":"Cafés","value":"cafes","polarity":"+"},
            {"label":"Sit-down restaurants","value":"sit-down","polarity":"+"},
            {"label":"Fine dining","value":"fine dining","polarity":"+"},
            {"label":"Cooking class","value":"cooking class","polarity":"+"},
            {"label":"Bars","value":"bars","polarity":"+"}
          ],
          "skip_ok": true }
      ]
    },
    {
      "id": "activities",
      "title": "Activities",
      "questions": [
        {"qid":"activities-01","text":"Which kinds of places do you enjoy visiting?","kind":"multi","dimension":"interests",
          "options": [
            {"label":"Museums","value":"museums","polarity":"+"},
            {"label":"Historic sites","value":"historic sites","polarity":"+"},
            {"label":"Architecture","value":"architecture","polarity":"+"},
            {"label":"Art galleries","value":"art galleries","polarity":"+"},
            {"label":"Gardens and parks","value":"gardens and parks","polarity":"+"},
            {"label":"Viewpoints","value":"viewpoints","polarity":"+"},
            {"label":"Religious sites","value":"religious sites","polarity":"+"},
            {"label":"Neighbourhoods","value":"neighbourhoods","polarity":"+"}
          ],
          "skip_ok": true },
        {"qid":"activities-02","text":"What do you like to do? Pick any.","kind":"multi","dimension":"activities",
          "options": [
            {"label":"Hiking","value":"hiking","polarity":"+"},
            {"label":"Walking tours","value":"walking tours","polarity":"+"},
            {"label":"Cycling","value":"cycling","polarity":"+"},
            {"label":"Swimming","value":"swimming","polarity":"+"},
            {"label":"Boat trips","value":"boat trips","polarity":"+"},
            {"label":"Live music","value":"live music","polarity":"+"},
            {"label":"Shopping","value":"shopping","polarity":"+"},
            {"label":"Photography","value":"photography","polarity":"+"},
            {"label":"Wine tasting","value":"wine tasting","polarity":"+"}
          ],
          "skip_ok": true },
        {"qid":"activities-03","text":"Anything you would rather skip?","kind":"multi","dimension":"activities",
          "options": [
            {"label":"Guided tours","value":"guided tours","polarity":"-"},
            {"label":"Nightlife","value":"nightlife","polarity":"-"},
            {"label":"Theme parks","value":"theme parks","polarity":"-"},
            {"label":"Long hikes","value":"long hikes","polarity":"-"}
          ],
          "skip_ok": true },
        {"qid":"activities-04","text":"Any other thing you always look for on a trip?","kind":"text","dimension":"activities",
          "options": [],
          "skip_ok": true }
      ]
    },
    {
      "id": "climate",
      "title": "Climate",
      "questions": [
        {"qid":"climate-01","text":"How do you cope with hot weather?","kind":"pick","dimension":"climate",
          "options": [
            {"label":"Heat is fine","value":"heat","polarity":"+"},
            {"label":"Avoid the heat","value":"heat","polarity":"-"}
          ],
          "skip_ok": true },
        {"qid":"climate-02","text":"And with cold weather?","kind":"pick","dimension":"climate",
          "options": [
            {"label":"Cold is fine","value":"cold","polarity":"+"},
            {"label":"Avoid the cold","value":"cold","polarity":"-"}
          ],
          "skip_ok": true },
        {"qid":"climate-03","text":"Is high humidity a problem?","kind":"pick","dimension":"climate",
          "options": [
            {"label":"Humidity is fine","value":"humidity","polarity":"+"},
            {"label":"Avoid humidity","value":"humidity","polarity":"-"}
          ],
          "skip_ok": true },
        {"qid":"climate-04","text":"Should rain change the plans?","kind":"pick","dimension":"climate",
          "options": [
            {"label":"Rain is fine","value":"rain","polarity":"+"},
            {"label":"Avoid rain","value":"rain","polarity":"-"}
          ],
          "skip_ok": true },
        {"qid":"climate-05","text":"Anything else to avoid? Pick any.","kind":"multi","dimension":"climate",
          "options": [
            {"label":"High altitude","value":"altitude","polarity":"-"},
            {"label":"Strong wind","value":"wind","polarity":"-"},
            {"label":"Long sun exposure","value":"long sun exposure","polarity":"-"}
          ],
          "skip_ok": true }
      ]
    },
    {
      "id": "mobility",
      "title": "Mobility",
      "questions": [
        {"qid":"mobility-01","text":"How far are you happy to walk in a day?","kind":"scale","dimension":"mobility",
          "options": [
            {"label":"Up to 5 km","value":"walks up to 5 km","polarity":"+"},
            {"label":"5 to 10 km","value":"walks 5 to 10 km","polarity":"+"},
            {"label":"More than 10 km","value":"walks over 10 km","polarity":"+"}
          ],
          "skip_ok": true },
        {"qid":"mobility-02","text":"Anything about walking or access to avoid?","kind":"multi","dimension":"mobility",
          "options": [
            {"label":"Steep stairs","value":"steep stairs","polarity":"-"},
            {"label":"Long walks","value":"long walks","polarity":"-"},
            {"label":"Uneven ground","value":"uneven ground","polarity":"-"},
            {"label":"Steep hills","value":"steep hills","polarity":"-"}
          ],
          "skip_ok": true },
        {"qid":"mobility-03","text":"Which ways of getting around do you like?","kind":"multi","dimension":"transport",
          "options": [
            {"label":"Walking","value":"walking","polarity":"+"},
            {"label":"Public transport","value":"public transport","polarity":"+"},
            {"label":"Taxis","value":"taxis","polarity":"+"},
            {"label":"Rental car","value":"rental car","polarity":"+"},
            {"label":"Bicycle","value":"bicycle","polarity":"+"},
            {"label":"Trains","value":"trains","polarity":"+"}
          ],
          "skip_ok": true },